<!DOCTYPE PAULA_CONFIG SYSTEM "../provider.dtd" [

<!ENTITY blocklist           "/etc/junkbuster/blocklist.local"       >
<!ENTITY forward             "/etc/junkbuster/forward"               >
<!ENTITY squid.conf          "/etc/squid/squid.conf"                 >
<!ENTITY junkbuster_status   "/etc/rc.d/init.d/junkbuster status |"  >
<!ENTITY chkconfig_status    "chkconfig --list junkbuster |"         >
<!ENTITY junkbuster_switch   "| /etc/rc.d/init.d/junkbuster"         > 
<!ENTITY chkconfig_switch    "| chkconfig"                           >
<!ENTITY squid_restart       "| /etc/rc.d/init.d/squid restart"      >
<!ENTITY download_blocklist  "/usr/bin/junkbuster_update"            >

]>

<PAULA_CONFIG>

  <!-- ********************* -->
  <!-- **** DEFINITIONS **** -->
  <!-- ********************* -->

  <DEFINITIONS>
    <DEFINE NAME="download_blocklist">&download_blocklist;</DEFINE>
  </DEFINITIONS>


  <!-- ******************** -->
  <!-- **** PROPERTIES **** -->
  <!-- ******************** -->

  <!-- ************************ -->
  <PROPERTY ID="FilterEnabled">
    <IN HANDLE="junkbuster_status">
      <FLAG DEFAULT="0"
	    VALUE="1" />
      <REGEXP MODIFIERS="ms">(.*)(running)(.*)</REGEXP>
    </IN>
    <IN HANDLE="chkconfig_status">
      <FLAG DEFAULT="0"
	    VALUE="1" />
      <REGEXP MODIFIERS="ms">(.*)(on)(.*)</REGEXP>
    </IN>
    <INOUT HANDLE="forward">
      <FLAG DEFAULT="0"
	    VALUE="1" 
            TEXT="\*\t\tlocalhost:3129\t.\t.\n"/>
      <REGEXP MODIFIERS="ms">(.*)(\*\s+localhost:3129\s+.\s+.\n)(.*)</REGEXP>
    </INOUT>
    <INOUT HANDLE="squid.conf">
      <FLAG DEFAULT="0"
	    VALUE="1" 
            TEXT="http_port\t3129\n" />
      <REGEXP MODIFIERS="ms">(.*)(^http_port\s+3129\n)(.*)</REGEXP>
    </INOUT>
    <OUT HANDLE="junkbuster_switch"> 
       <FUNCTION/> 
    </OUT> 
    <OUT HANDLE="chkconfig_switch"> 
       <FUNCTION/> 
    </OUT> 
    <OUT HANDLE="squid_restart"> 
    </OUT> 
  </PROPERTY>


  <!-- *************** -->
  <PROPERTY ID="BlockList"
	    MIGHT_BE_NULL="true">
    <IN HANDLE="blocklist">
      <OPTIONAL_ASSIGNMENT/>
      <FUNCTION/> 
    </IN>
    <OUT HANDLE="blocklist">
      <OPTIONAL_ASSIGNMENT/>
      <FUNCTION/> 
    </OUT>
  </PROPERTY>

  <!-- ****************** -->
  <!-- **** SECTIONS **** -->
  <!-- ****************** -->


  <!-- ***************** -->
  <!-- **** HANDLES **** -->
  <!-- ***************** -->

  <HANDLE ID="blocklist"            NO="1"      TYPE="FILE"       ACCESS="RW"
	  NAME="&blocklist;">
    <WHITESPACE WRITE=" " />
    <COMMENTS>
      <READ.LINE>#</READ.LINE>
      <WRITE.LINE> #</WRITE.LINE>
    </COMMENTS>
  </HANDLE>

  <HANDLE ID="forward"              NO="2"      TYPE="FILE"       ACCESS="RW"
	  NAME="&forward;">
    <WHITESPACE WRITE=" " />
    <COMMENTS>
      <READ.LINE>#</READ.LINE>
      <WRITE.LINE> #</WRITE.LINE>
    </COMMENTS>
  </HANDLE>

  <HANDLE ID="junkbuster_status"    NO="3"     TYPE="COMMAND"     ACCESS="R"
	NAME="&junkbuster_status;">
  </HANDLE>

  <HANDLE ID="chkconfig_status"     NO="4"     TYPE="COMMAND"     ACCESS="R"
	NAME="&chkconfig_status;">
  </HANDLE>

  <HANDLE ID="junkbuster_switch"    NO="5"     TYPE="COMMAND"     ACCESS="W"
	NAME="&junkbuster_switch;">
  </HANDLE>

  <HANDLE ID="chkconfig_switch"     NO="6"     TYPE="COMMAND"     ACCESS="W"
	NAME="&chkconfig_switch;">
  </HANDLE>

  <HANDLE ID="squid.conf"           NO="7"     TYPE="FILE"        ACCESS="RW"
	  NAME="&squid.conf;">
    <WHITESPACE WRITE=" " />
    <COMMENTS>
      <READ.LINE>#</READ.LINE>
      <WRITE.LINE> #</WRITE.LINE>
    </COMMENTS>
  </HANDLE>

  <HANDLE ID="squid_restart"        NO="8"     TYPE="COMMAND"     ACCESS="W"
	NAME="&squid_restart;">
  </HANDLE>

</PAULA_CONFIG>

<!--
Copyright (c) 2000 ID-PRO Deutschland GmbH. All rights reserved.

This program is free software; you can redistribute it and/or
modify it under the terms of the GNU General Public License
as published by the Free Software Foundation; either version 2
of the License, or (at your option) any later version.

This program is distributed in the hope that it will be useful,
but WITHOUT ANY WARRANTY; without even the implied warranty of
MERCHANTABILITY or FITNESS FOR A PARTICULAR PURPOSE.  See the
GNU General Public License for more details.

You should have received a copy of the GNU General Public License
along with this program; if not, write to the Free Software
Foundation, Inc., 59 Temple Place - Suite 330, Boston, MA  02111-1307,
USA.
-->
