<!DOCTYPE PAULA_CONFIG SYSTEM "../provider.dtd" [

<!ENTITY aliases          "files/postfix/aliases"        >
<!ENTITY dlists           "files/postfix/dlists.virtual" >
<!ENTITY main.cf          "files/postfix/main.cf"        >
<!ENTITY virtual          "files/postfix/virtual"        >
<!ENTITY postmap_dlists   "| postmap.sh dlists.virtual"  >
<!ENTITY postmap_aliases  "| postmap.sh aliases"         >
<!ENTITY postmap_virtual  "| postmap.sh virtual"         >
<!ENTITY postfix_reload   "| postmap.sh reload"          >
<!ENTITY perl             "| perl"                       >

]>

<PAULA_CONFIG>

  <!-- ******************** -->
  <!-- **** PROPERTIES **** -->
  <!-- ******************** -->


  <!-- **************************** -->
  <PROPERTY ID="ValidDistributionLists"
	    MIGHT_BE_NULL="true">
    <INOUT HANDLE="dlists">
      <OPTIONAL_ASSIGNMENT/>
      <FUNCTION/>
    </INOUT>
    <OUT HANDLE="postmap_dlists">
    </OUT>
    <OUT HANDLE="postfix_reload">
    </OUT>
  </PROPERTY>

  <!-- ******************* -->
  <PROPERTY ID="MailAliasRoot"
	    MIGHT_BE_NULL="true">
    <INOUT HANDLE="aliases">
      <OPTIONAL_ASSIGNMENT
                            TEXT="root:\t$VAR\n"
                            DELETE_IF_DEFAULT="true"/>
      <REGEXP MODIFIERS="ms">.*^(root:[^\n\S]+(\S+)\n)$.*</REGEXP>
    </INOUT>
    <OUT HANDLE="postmap_aliases">
    </OUT>
    <OUT HANDLE="postfix_reload">
    </OUT>
  </PROPERTY>

  <!-- ************************** -->
  <PROPERTY ID="MailAliasPostmaster">
    <INOUT HANDLE="aliases">
      <REQUIRED_ASSIGNMENT/>
      <REGEXP MODIFIERS="ms">(.*^postmaster:[^\n\S]+)(\S+)($.*)</REGEXP>
    </INOUT>
    <OUT HANDLE="postmap_aliases">
    </OUT>
    <OUT HANDLE="postfix_reload">
    </OUT>
  </PROPERTY>

  <!-- ************************** -->
  <PROPERTY ID="MailAliasFaxmaster">
    <INOUT HANDLE="aliases">
      <REQUIRED_ASSIGNMENT/>
      <REGEXP MODIFIERS="ms">(.*^faxmaster:[^\n\S]+)(\S+)($.*)</REGEXP>
    </INOUT>
    <OUT HANDLE="postmap_aliases">
    </OUT>
    <OUT HANDLE="postfix_reload">
    </OUT>
  </PROPERTY>

  <!-- *************** -->
  <PROPERTY ID="MyDomain">
    <INOUT HANDLE="main.cf">
      <REQUIRED_ASSIGNMENT/>
      <REGEXP MODIFIERS="ms">(.*^mydomain\s*=\s*)(\S+)($.*)</REGEXP>
    </INOUT>
    <OUT HANDLE="perl">
    </OUT>
    <OUT HANDLE="postmap_virtual">
    </OUT>
    <OUT HANDLE="postfix_reload">
    </OUT>
  </PROPERTY>

  <!-- *************** -->
  <PROPERTY ID="RelayHost"
	    MIGHT_BE_NULL="true">
    <INOUT HANDLE="main.cf">
      <OPTIONAL_ASSIGNMENT TEXT="relayhost = [$VAR]\n"
			   DELETE_IF_DEFAULT="true" />
      <REGEXP MODIFIERS="ms">.*^(relayhost\s*=\s*\[?([^\]\s]+)\]?)$.*</REGEXP>
    </INOUT>
    <OUT HANDLE="postfix_reload">
    </OUT>
  </PROPERTY>

  <!-- ****************** -->
  <!-- **** SECTIONS **** -->
  <!-- ****************** -->



  <!-- ***************** -->
  <!-- **** HANDLES **** -->
  <!-- ***************** -->

  <HANDLE ID="dlists"           NO="1"      TYPE="FILE"        ACCESS="RW"
        NAME="&dlists;">
    <WHITESPACE WRITE=" " />
    <COMMENTS>
      <READ.LINE>#</READ.LINE>
      <WRITE.LINE> #</WRITE.LINE>
    </COMMENTS>
  </HANDLE>

  <HANDLE ID="postmap_dlists"   NO="2"      TYPE="COMMAND"     ACCESS="W"
	  NAME="&postmap_dlists;">
  </HANDLE>

  <HANDLE ID="aliases"          NO="3"      TYPE="FILE"        ACCESS="RW"
	  NAME="&aliases;">
    <WHITESPACE WRITE=" " />
    <COMMENTS>
      <READ.LINE>#</READ.LINE>
      <WRITE.LINE> #</WRITE.LINE>
    </COMMENTS>
  </HANDLE>

  <HANDLE ID="postmap_aliases"  NO="4"      TYPE="COMMAND"     ACCESS="W"
	  NAME="&postmap_aliases;">
  </HANDLE>

  <HANDLE ID="main.cf"          NO="5"      TYPE="FILE"        ACCESS="RW"
	  NAME="&main.cf;">
    <WHITESPACE WRITE=" " />
    <COMMENTS>
      <READ.LINE>#</READ.LINE>
      <WRITE.LINE> #</WRITE.LINE>
    </COMMENTS>
  </HANDLE>

  <HANDLE ID="virtual"          NO="6"      TYPE="FILE"        ACCESS="RW"
	  NAME="&virtual;">
    <WHITESPACE WRITE=" " />
    <COMMENTS>
      <READ.LINE>#</READ.LINE>
      <WRITE.LINE> #</WRITE.LINE>
    </COMMENTS>
  </HANDLE>

  <HANDLE ID="perl"             NO="7"      TYPE="COMMAND"     ACCESS="W"
	  NAME="&perl;">
  </HANDLE>

  <HANDLE ID="postmap_virtual"  NO="8"      TYPE="COMMAND"     ACCESS="W"
	  NAME="&postmap_virtual;">
  </HANDLE>

  <HANDLE ID="postfix_reload"   NO="9"      TYPE="COMMAND"     ACCESS="W"
	  NAME="&postfix_reload;">
  </HANDLE>

</PAULA_CONFIG>

<!--
Copyright (c) 2000 ID-PRO Deutschland GmbH. All rights reserved.

This program is free software; you can redistribute it and/or
modify it under the terms of the GNU General Public License
as published by the Free Software Foundation; either version 2
of the License, or (at your option) any later version.

This program is distributed in the hope that it will be useful,
but WITHOUT ANY WARRANTY; without even the implied warranty of
MERCHANTABILITY or FITNESS FOR A PARTICULAR PURPOSE.  See the
GNU General Public License for more details.

You should have received a copy of the GNU General Public License
along with this program; if not, write to the Free Software
Foundation, Inc., 59 Temple Place - Suite 330, Boston, MA  02111-1307,
USA.
-->
