<!DOCTYPE PAULA_CONFIG SYSTEM "../provider.dtd" [

<!ENTITY pcron.conf         "???/pcron.conf"                >
<!ENTITY ip-up              "/etc/ppp/ip-up.local"          >
<!ENTITY fetchmailrc        "/root/.fetchmailrc"            >

]>

<PAULA_CONFIG>

  <!-- ********************* -->
  <!-- **** DEFINITIONS **** -->
  <!-- ********************* -->

  <DEFINITIONS>
    <DEFINE NAME="fetchmailrc">&fetchmailrc;</DEFINE>
  </DEFINITIONS>


  <!-- ******************** -->
  <!-- **** PROPERTIES **** -->
  <!-- ******************** -->


  <!-- *********************** -->
  <PROPERTY ID="MailWeekdaysStart"
	    MIGHT_BE_NULL="true">
    <DEPENDENCIES>
      <IN_DEP PROPERTY="MailWeekdaysEnd" />
      <IN_DEP PROPERTY="MailWeekdaysInterval" />
      <OUT_DEP PROPERTY="MailWeekdaysEnd" />
      <OUT_DEP PROPERTY="MailWeekdaysInterval" />
    </DEPENDENCIES>
    <IN HANDLE="pcron.conf">
      <OPTIONAL_ASSIGNMENT/>
      <REGEXP MODIFIERS="ms">.*^(fetchmail.*?;m\d+Wk(\d+)-\d+\s*)</REGEXP>
    </IN>
  </PROPERTY>

  <!-- ********************* -->
  <PROPERTY ID="MailWeekdaysEnd"
	    MIGHT_BE_NULL="true">
    <DEPENDENCIES>
      <IN_DEP PROPERTY="MailWeekdaysStart" />
      <IN_DEP PROPERTY="MailWeekdaysInterval" />
      <OUT_DEP PROPERTY="MailWeekdaysStart" />
      <OUT_DEP PROPERTY="MailWeekdaysInterval" />
    </DEPENDENCIES>
    <IN HANDLE="pcron.conf">
      <OPTIONAL_ASSIGNMENT/>
      <REGEXP MODIFIERS="ms">.*?^(fetchmail.*?;m\d+Wk\d+-(\d+)\s*)</REGEXP>
    </IN>
  </PROPERTY>

  <!-- ************************** -->
  <PROPERTY ID="MailWeekdaysInterval" 
            MIGHT_BE_NULL="true">
    <DEPENDENCIES>
      <IN_DEP PROPERTY="MailWeekdaysStart" />
      <IN_DEP PROPERTY="MailWeekdaysEnd" />
      <OUT_DEP PROPERTY="MailWeekdaysStart" />
      <OUT_DEP PROPERTY="MailWeekdaysEnd" />
    </DEPENDENCIES>
    <IN HANDLE="pcron.conf">
      <OPTIONAL_ASSIGNMENT/>
      <REGEXP MODIFIERS="ms">.*?^(fetchmail.*?;m(\d+)Wk\d+-\d+\s*)</REGEXP>
    </IN>
    <OUT HANDLE="pcron.conf" FORCE_WRITE="true">
      <REQUIRED_ASSIGNMENT/>
      <FUNCTION/>
    </OUT>
  </PROPERTY>


  <!-- ********************** -->
  <PROPERTY ID="MailWeekendStart"
	    MIGHT_BE_NULL="true">
    <DEPENDENCIES>
      <IN_DEP PROPERTY="MailWeekendEnd" />
      <IN_DEP PROPERTY="MailWeekendInterval" />
      <OUT_DEP PROPERTY="MailWeekendEnd" />
      <OUT_DEP PROPERTY="MailWeekendInterval" />
    </DEPENDENCIES>
    <IN HANDLE="pcron.conf">
      <OPTIONAL_ASSIGNMENT/>
      <REGEXP MODIFIERS="ms">.*^(fetchmail.*?;m\d+Wd(\d+)-\d+)$</REGEXP>
    </IN>
  </PROPERTY>

  <!-- ******************** -->
  <PROPERTY ID="MailWeekendEnd"
	    MIGHT_BE_NULL="true">
    <DEPENDENCIES>
      <IN_DEP PROPERTY="MailWeekendStart" />
      <IN_DEP PROPERTY="MailWeekendInterval" />
      <OUT_DEP PROPERTY="MailWeekendStart" />
      <OUT_DEP PROPERTY="MailWeekendInterval" />
    </DEPENDENCIES>
    <IN HANDLE="pcron.conf">
      <OPTIONAL_ASSIGNMENT/>
      <REGEXP MODIFIERS="ms">.*^(fetchmail.*?;m\d+Wd\d+-(\d+))$</REGEXP>
    </IN>
  </PROPERTY>

  <!-- ************************* -->
  <PROPERTY ID="MailWeekendInterval" 
            MIGHT_BE_NULL="true">
    <DEPENDENCIES>
      <IN_DEP PROPERTY="MailWeekendStart" />
      <IN_DEP PROPERTY="MailWeekendEnd" />
      <OUT_DEP PROPERTY="MailWeekendStart" />
      <OUT_DEP PROPERTY="MailWeekendEnd" />
    </DEPENDENCIES>
    <IN HANDLE="pcron.conf">
      <OPTIONAL_ASSIGNMENT/>
      <REGEXP MODIFIERS="ms">.*^(fetchmail.*?;m(\d+)Wd\d+-\d+)$</REGEXP>
    </IN>
    <OUT HANDLE="pcron.conf" FORCE_WRITE="true">
      <REQUIRED_ASSIGNMENT/>
      <FUNCTION/>
    </OUT>
  </PROPERTY>


  <!-- ************************* -->
  <PROPERTY ID="FetchMailsOnDialUp">
    <INOUT HANDLE="ip-up">
      <FLAG DEFAULT="0"
	    VALUE="1"
	    TEXT="fetchmail -f &fetchmailrc;\n"/>
      <REGEXP MODIFIERS="ms">(.*^)(fetchmail -f &fetchmailrc;\n)($.*)</REGEXP>
    </INOUT>
  </PROPERTY>

  <!-- ****************** -->
  <!-- **** SECTIONS **** -->
  <!-- ****************** -->



  <!-- ***************** -->
  <!-- **** HANDLES **** -->
  <!-- ***************** -->

  <HANDLE ID="pcron.conf"           NO="1"      TYPE="FILE"        ACCESS="RW"
        NAME="&pcron.conf;">
    <WHITESPACE WRITE=" " />
    <COMMENTS>
      <READ.LINE>#</READ.LINE>
      <WRITE.LINE> #</WRITE.LINE>
    </COMMENTS>
  </HANDLE>

  <HANDLE ID="ip-up"                NO="2"      TYPE="FILE"        ACCESS="RW"
        NAME="&ip-up;">
    <WHITESPACE WRITE=" " />
    <COMMENTS>
      <READ.LINE>#</READ.LINE>
      <WRITE.LINE> #</WRITE.LINE>
    </COMMENTS>
  </HANDLE>

</PAULA_CONFIG>

<!--
Copyright (c) 2000 ID-PRO Deutschland GmbH. All rights reserved.

This program is free software; you can redistribute it and/or
modify it under the terms of the GNU General Public License
as published by the Free Software Foundation; either version 2
of the License, or (at your option) any later version.

This program is distributed in the hope that it will be useful,
but WITHOUT ANY WARRANTY; without even the implied warranty of
MERCHANTABILITY or FITNESS FOR A PARTICULAR PURPOSE.  See the
GNU General Public License for more details.

You should have received a copy of the GNU General Public License
along with this program; if not, write to the Free Software
Foundation, Inc., 59 Temple Place - Suite 330, Boston, MA  02111-1307,
USA.
-->
