<!DOCTYPE PAULA_CONFIG SYSTEM "../provider.dtd" [

<!ENTITY vpnd.conf          "files/vpnd.conf"            >
<!ENTITY ifconfig           "ifconfig.sh |"              >
<!ENTITY chkconfig_status   "chkconfig.sh --list vpnd |" >
<!ENTITY vpnd_status        "vpnd.sh status |"           >
<!ENTITY vpnd_switch        "| vpnd.sh"                  >
<!ENTITY chkconfig_switch   "| chkconfig.sh"             >

]>

<PAULA_CONFIG>

  <!-- ******************** -->
  <!-- **** PROPERTIES **** -->
  <!-- ******************** -->


  <!-- *************** -->
  <PROPERTY ID="ServerIP">
    <DEPENDENCIES>
      <INOUT_DEP PROPERTY="VPNEnabled" />
      <INOUT_DEP PROPERTY="ServerPort" />
    </DEPENDENCIES>
    
    <INOUT HANDLE="vpnd.conf">
      <REQUIRED_ASSIGNMENT/>
      <REGEXP MODIFIERS="ms">(.*^server[^\S\n]+)((?:\d+\.\S+)*)(.*)</REGEXP>
    </INOUT>
  </PROPERTY>

  <!-- ***************** -->
  <PROPERTY ID="ServerPort">
    <DEPENDENCIES>
      <INOUT_DEP PROPERTY="VPNEnabled" />
    </DEPENDENCIES>
    
    <INOUT HANDLE="vpnd.conf2">
      <REQUIRED_ASSIGNMENT/>
      <REGEXP MODIFIERS="ms">(.*^server[^\n\S]+?\S*(?:\d+\.\S+)*[^\n\S]*)(\S*)($.*)</REGEXP>
    </INOUT>
  </PROPERTY>

  <!-- ************* -->
  <PROPERTY ID="Remote">
    <DEPENDENCIES>
      <IN_DEP PROPERTY="RouteLocalNetwork" />
      <INOUT_DEP PROPERTY="VPNEnabled" />
    </DEPENDENCIES>
    
    <INOUT HANDLE="vpnd.conf">
      <REQUIRED_ASSIGNMENT/>
      <REGEXP MODIFIERS="ms">(.*^remote[^\n\S]+)(\S*)$.*</REGEXP>
    </INOUT>
    <OUT HANDLE="vpnd.conf">
      <FUNCTION/>
    </OUT>
  </PROPERTY>

  <!-- ************ -->
  <PROPERTY ID="Local">
    <DEPENDENCIES>
      <INOUT_DEP PROPERTY="VPNEnabled" />
    </DEPENDENCIES>
    
    <INOUT HANDLE="vpnd.conf">
      <REQUIRED_ASSIGNMENT/>
      <REGEXP  MODIFIERS="ms">(.*^local[^\n\S]+)(\S*)$.*</REGEXP>
    </INOUT>
  </PROPERTY>
  
  <!-- *************** -->
  <PROPERTY ID="IsServer">
    <DEPENDENCIES>
      <INOUT_DEP PROPERTY="VPNEnabled" />
    </DEPENDENCIES>
    
    <INOUT HANDLE="vpnd.conf">
      <REQUIRED_ASSIGNMENT/>
      <FUNCTION/>
    </INOUT>
  </PROPERTY>
  
  <!-- ************************ -->
  <PROPERTY ID="RouteLocalNetwork">
    <DEPENDENCIES>
      <IN_DEP PROPERTY="Remote" />
      <IN_DEP PROPERTY="InetAddr" />
      <IN_DEP PROPERTY="Mask" />
      <INOUT_DEP PROPERTY="VPNEnabled" />
    </DEPENDENCIES>
    
    <IN HANDLE="vpnd.conf">
      <FLAG DEFAULT="0"
            VALUE="1" />
      <REGEXP MODIFIERS="ms">(.*^)(route1\s.*?$).*</REGEXP>
    </IN>
    <OUT HANDLE="vpnd.conf" FORCE_WRITE="true">
      <REQUIRED_ASSIGNMENT/>
      <FUNCTION/>
    </OUT>
  </PROPERTY>

  <!-- ***************** -->
  <PROPERTY ID="VPNEnabled">
    <IN HANDLE="vpnd_status">
      <FLAG DEFAULT="0"
	    VALUE="1" />
      <REGEXP MODIFIERS="ms">(.*)(is running)(.*)</REGEXP>
    </IN>
    <IN HANDLE="chkconfig_status">
      <FLAG DEFAULT="0"
	    VALUE="1" />
      <REGEXP MODIFIERS="ms">(.*)(on)(.*)</REGEXP>
    </IN>
    <OUT HANDLE="vpnd_switch">
       <FUNCTION/>
    </OUT>
    <OUT HANDLE="chkconfig_switch">
       <FUNCTION/>
    </OUT>
  </PROPERTY>

  <!-- *************** -->
  <PROPERTY ID="InetAddr">
    <IN SECTION="eth0" HANDLE="ifconfig">
      <REQUIRED_ASSIGNMENT/>
      <REGEXP MODIFIERS="ms">(.*\binet addr:)(\S+).*</REGEXP>
    </IN>
  </PROPERTY>

  <!-- *********** -->
  <PROPERTY ID="Mask">
    <IN SECTION="eth0" HANDLE="ifconfig">
      <REQUIRED_ASSIGNMENT/>
      <REGEXP  MODIFIERS="ms">(.*\bMask:)(\S+).*</REGEXP>
    </IN>
  </PROPERTY>


  <!-- ****************** -->
  <!-- **** SECTIONS **** -->
  <!-- ****************** -->

  <SECTION ID="eth0">
    <REGEXP MODIFIERS="ms">(.*^eth0\s+)(.*?\n\n)(.*)</REGEXP>
  </SECTION>


  <!-- ***************** -->
  <!-- **** HANDLES **** -->
  <!-- ***************** -->

  <HANDLE ID="vpnd.conf"            NO="1"      TYPE="FILE"        ACCESS="RW"
        NAME="&vpnd.conf;">
    <WHITESPACE WRITE=" " />
    <COMMENTS>
      <READ.LINE>#</READ.LINE>
      <WRITE.LINE> #</WRITE.LINE>
    </COMMENTS>
  </HANDLE>

  <HANDLE ID="vpnd.conf2"            NO="2"      TYPE="FILE"        ACCESS="RW"
        NAME="&vpnd.conf;">
    <WHITESPACE WRITE=" " />
    <COMMENTS>
      <READ.LINE>#</READ.LINE>
      <WRITE.LINE> #</WRITE.LINE>
    </COMMENTS>
  </HANDLE>

  <HANDLE ID="ifconfig"             NO="3"      TYPE="COMMAND"     ACCESS="R"
	  NAME="&ifconfig;">
  </HANDLE>

  <HANDLE ID="vpnd_status"          NO="5"     TYPE="COMMAND"     ACCESS="R"
	NAME="&vpnd_status;">
  </HANDLE>

  <HANDLE ID="chkconfig_status"     NO="6"     TYPE="COMMAND"     ACCESS="R"
	NAME="&chkconfig_status;">
  </HANDLE>

  <HANDLE ID="vpnd_switch"          NO="7"     TYPE="COMMAND"     ACCESS="W"
	NAME="&vpnd_switch;">
  </HANDLE>

  <HANDLE ID="chkconfig_switch"     NO="8"     TYPE="COMMAND"     ACCESS="W"
	NAME="&chkconfig_switch;">
  </HANDLE>

</PAULA_CONFIG>

<!--
Copyright (c) 2000 ID-PRO Deutschland GmbH. All rights reserved.

This program is free software; you can redistribute it and/or
modify it under the terms of the GNU General Public License
as published by the Free Software Foundation; either version 2
of the License, or (at your option) any later version.

This program is distributed in the hope that it will be useful,
but WITHOUT ANY WARRANTY; without even the implied warranty of
MERCHANTABILITY or FITNESS FOR A PARTICULAR PURPOSE.  See the
GNU General Public License for more details.

You should have received a copy of the GNU General Public License
along with this program; if not, write to the Free Software
Foundation, Inc., 59 Temple Place - Suite 330, Boston, MA  02111-1307,
USA.
-->
