<!DOCTYPE PAULA_CONFIG SYSTEM "../provider.dtd" [

<!ENTITY groups.paula          "/etc/percimon/PaulA/groups.paula"   >

]>

<PAULA_CONFIG>

  <!-- ******************** -->
  <!-- **** PROPERTIES **** -->
  <!-- ******************** -->

  <!-- ****************** -->
  <PROPERTY ID="Permissions">
    <INOUT SECTION="s1" HANDLE="groups.paula">
      <REQUIRED_ASSIGNMENT/>
      <FUNCTION/>
    </INOUT>
  </PROPERTY>

  <!-- ********************* -->
  <!-- **** KEYBINDINGS **** -->
  <!-- ********************* -->

  <KEYBINDINGS>
    <IN HANDLE="groups.paula">
    </IN>
  </KEYBINDINGS>

  <!-- ****************** -->
  <!-- **** SECTIONS **** -->
  <!-- ****************** -->

  <SECTION ID="s1">
    <REGEXP MODIFIERS="ms">(.*?^Group \"$KEY_Name\"\s*\n)(.+?)(^EndGroup$.*)</REGEXP>
  </SECTION>



  <!-- ***************** -->
  <!-- **** HANDLES **** -->
  <!-- ***************** -->

  <HANDLE ID="groups.paula"         NO="1"      TYPE="FILE"        ACCESS="RW"
	  NAME="&groups.paula;">
    <WHITESPACE WRITE=" " />
    <COMMENTS>
      <READ.LINE>#</READ.LINE>
      <WRITE.LINE> #</WRITE.LINE>
    </COMMENTS>
  </HANDLE>

</PAULA_CONFIG>

<!--
Copyright (c) 2000 ID-PRO Deutschland GmbH. All groups.paula reserved.

This program is free software; you can redistribute it and/or
modify it under the terms of the GNU General Public License
as published by the Free Software Foundation; either version 2
of the License, or (at your option) any later version.

This program is distributed in the hope that it will be useful,
but WITHOUT ANY WARRANTY; without even the implied warranty of
MERCHANTABILITY or FITNESS FOR A PARTICULAR PURPOSE.  See the
GNU General Public License for more details.

You should have received a copy of the GNU General Public License
along with this program; if not, write to the Free Software
Foundation, Inc., 59 Temple Place - Suite 330, Boston, MA  02111-1307,
USA.
-->
