<!DOCTYPE PAULA_CONFIG SYSTEM "../provider.dtd" [

<!ENTITY transport      "files/postfix/transport"   >
<!ENTITY postmap        "| postmap.sh transport"    >
<!ENTITY groups.paula   "files/groups.paula"        >
<!ENTITY group          "files/group"               >
]>

<PAULA_CONFIG>

  <!-- ******************** -->
  <!-- **** PROPERTIES **** -->
  <!-- ******************** -->

  <PROPERTY ID="Create_OutgoingMailDomain" MIGHT_BE_NULL="true">
    <INOUT HANDLE="transport">
      <REQUIRED_ASSIGNMENT/>
      <FUNCTION/>
    </INOUT>
    <OUT HANDLE="postmap">
    </OUT>
  </PROPERTY>

  <PROPERTY ID="Delete_OutgoingMailDomain" MIGHT_BE_NULL="true">
    <INOUT HANDLE="transport">
      <REQUIRED_ASSIGNMENT/>
      <FUNCTION/>
    </INOUT>
    <OUT HANDLE="postmap">
    </OUT>
  </PROPERTY>

  <PROPERTY ID="Create_Group" MIGHT_BE_NULL="true">
    <INOUT HANDLE="groups.paula">
      <REQUIRED_ASSIGNMENT/>
      <FUNCTION/>
    </INOUT>
    <OUT HANDLE="group">
      <OPTIONAL_ASSIGNMENT/>
      <FUNCTION/>
    </OUT> 
  </PROPERTY>

  <PROPERTY ID="Delete_Group" MIGHT_BE_NULL="true">
    <INOUT HANDLE="groups.paula">
      <REQUIRED_ASSIGNMENT/>
      <FUNCTION/>
    </INOUT>
    <OUT HANDLE="group">
      <OPTIONAL_ASSIGNMENT/>
      <FUNCTION/>
    </OUT> 
  </PROPERTY>

  <!-- ****************** -->
  <!-- **** SECTIONS **** -->
  <!-- ****************** -->


  <!-- ***************** -->
  <!-- **** HANDLES **** -->
  <!-- ***************** -->

  <HANDLE ID="transport"           NO="1"      TYPE="FILE"        ACCESS="RW"
        NAME="&transport;">
    <WHITESPACE WRITE=" " />
    <COMMENTS>
      <READ.LINE>#</READ.LINE>
      <WRITE.LINE> #</WRITE.LINE>
    </COMMENTS>
  </HANDLE>

  <HANDLE ID="postmap"              NO="2"      TYPE="COMMAND"     ACCESS="W"
	  NAME="&postmap;">
  </HANDLE>

  <HANDLE ID="groups.paula"         NO="3"      TYPE="FILE"        ACCESS="RW"
	  NAME="&groups.paula;">
    <WHITESPACE WRITE=" " />
    <COMMENTS>
      <READ.LINE>#</READ.LINE>
      <WRITE.LINE> #</WRITE.LINE>
    </COMMENTS>
  </HANDLE>

  <HANDLE ID="group"                NO="4"      TYPE="FILE"        ACCESS="RW"
	  NAME="&group;">
    <WHITESPACE WRITE=" " />
    <COMMENTS>
      <READ.LINE>#</READ.LINE>
      <WRITE.LINE> #</WRITE.LINE>
    </COMMENTS>
  </HANDLE>

</PAULA_CONFIG>

<!--
Copyright (c) 2000 ID-PRO Deutschland GmbH. All rights reserved.

This program is free software; you can redistribute it and/or
modify it under the terms of the GNU General Public License
as published by the Free Software Foundation; either version 2
of the License, or (at your option) any later version.

This program is distributed in the hope that it will be useful,
but WITHOUT ANY WARRANTY; without even the implied warranty of
MERCHANTABILITY or FITNESS FOR A PARTICULAR PURPOSE.  See the
GNU General Public License for more details.

You should have received a copy of the GNU General Public License
along with this program; if not, write to the Free Software
Foundation, Inc., 59 Temple Place - Suite 330, Boston, MA  02111-1307,
USA.
-->
