<!DOCTYPE PAULA_CONFIG SYSTEM "../provider.dtd" [

<!ENTITY packetfilter       "files/packetfilter"        >
<!ENTITY restart            "misc.sh reload |"      >   <!-- mark -->

]>

<PAULA_CONFIG>

  <!-- ******************** -->
  <!-- **** PROPERTIES **** -->
  <!-- ******************** -->

  <!-- **************** -->
  <PROPERTY ID="TelnetEnabled"
	    MIGHT_BE_NULL="true">
    <INOUT SECTION="telnet" HANDLE="packetfilter">
      <FLAG DEFAULT="0"
            VALUE="1"
            TEXT="/etc/packetfilter/telnet" />
      <REGEXP MODIFIERS="ms">(.*^)(/etc/packetfilter/telnet)(.*)</REGEXP>
    </INOUT>
    <OUT HANDLE="restart">
    </OUT>
  </PROPERTY>


  <!-- ****************** -->
  <!-- **** SECTIONS **** -->
  <!-- ****************** -->

  <SECTION ID="telnet">
    <REGEXP MODIFIERS="ms">(.*echo\s+"Telnet\s+bla"\n)([^\n]*)(.*)</REGEXP>
  </SECTION>

  <!-- ***************** -->
  <!-- **** HANDLES **** -->
  <!-- ***************** -->

  <HANDLE ID="packetfilter"           NO="1"      TYPE="FILE"        ACCESS="RW"
        NAME="&packetfilter;">
    <WHITESPACE WRITE=" " />
    <COMMENTS>
      <READ.LINE>#</READ.LINE>
      <WRITE.LINE> #</WRITE.LINE>
    </COMMENTS>
  </HANDLE>

  <HANDLE ID="restart"        NO="2"      TYPE="COMMAND"     ACCESS="W"
	  NAME="&restart;">
  </HANDLE>


</PAULA_CONFIG>

<!--
Copyright (c) 2000 ID-PRO Deutschland GmbH. All rights reserved.

This program is free software; you can redistribute it and/or
modify it under the terms of the GNU General Public License
as published by the Free Software Foundation; either version 2
of the License, or (at your option) any later version.

This program is distributed in the hope that it will be useful,
but WITHOUT ANY WARRANTY; without even the implied warranty of
MERCHANTABILITY or FITNESS FOR A PARTICULAR PURPOSE.  See the
GNU General Public License for more details.

You should have received a copy of the GNU General Public License
along with this program; if not, write to the Free Software
Foundation, Inc., 59 Temple Place - Suite 330, Boston, MA  02111-1307,
USA.
-->
